{
  "$schema": "https://json-schema.org/draft/2020-12/schema",
  "type": "object",
  "additionalProperties": false,
  "required": [
    "bundle_a_ciphertext_sha256",
    "bundle_a_result_sha256",
    "bundle_a_state",
    "bundle_b_bytes",
    "bundle_b_ciphertext_sha256",
    "bundle_b_disposition",
    "bundle_b_encryption",
    "bundle_b_object_key_sha256",
    "bundle_b_prior_version_id_sha256",
    "bundle_b_publication_evidence_sha256",
    "bundle_b_result_sha256",
    "bundle_b_state",
    "bundle_b_version_id_sha256",
    "independent_ciphertexts",
    "plaintext_sha256",
    "published_at",
    "recovery_evidence_sha256",
    "repository_id",
    "snapshot_id",
    "source_commit",
    "totp_secret_included",
    "version"
  ],
  "properties": {
    "bundle_a_ciphertext_sha256": { "type": "string", "pattern": "^[0-9a-f]{64}$" },
    "bundle_a_result_sha256": { "type": "string", "pattern": "^[0-9a-f]{64}$" },
    "bundle_a_state": { "const": "protected-local" },
    "bundle_b_bytes": { "const": 114746920 },
    "bundle_b_ciphertext_sha256": { "type": "string", "pattern": "^[0-9a-f]{64}$" },
    "bundle_b_disposition": { "enum": ["created-version", "adopted-current"] },
    "bundle_b_encryption": { "const": "aws:kms" },
    "bundle_b_object_key_sha256": { "type": "string", "pattern": "^[0-9a-f]{64}$" },
    "bundle_b_prior_version_id_sha256": { "type": "string", "pattern": "^[0-9a-f]{64}$" },
    "bundle_b_publication_evidence_sha256": { "type": "string", "pattern": "^[0-9a-f]{64}$" },
    "bundle_b_result_sha256": { "type": "string", "pattern": "^[0-9a-f]{64}$" },
    "bundle_b_state": { "const": "published-verified-current" },
    "bundle_b_version_id_sha256": { "type": "string", "pattern": "^[0-9a-f]{64}$" },
    "independent_ciphertexts": { "const": true },
    "plaintext_sha256": { "type": "string", "pattern": "^[0-9a-f]{64}$" },
    "published_at": { "type": "string", "pattern": "^[0-9]{4}-[0-9]{2}-[0-9]{2}T[0-9]{2}:[0-9]{2}:[0-9]{2}Z$" },
    "recovery_evidence_sha256": { "type": "string", "pattern": "^[0-9a-f]{64}$" },
    "repository_id": { "const": "dce8dbc3cde106047631317a09257c23ee5eab4d9ece5f88d52108ae384a8503" },
    "snapshot_id": { "const": "a42e4694ac164d62bb1c815144ea6407f70ab1e8ee91c54f293b2acdb77dcfea" },
    "source_commit": { "const": "72909b5723ae8d586f5b3db428b7d73f6c610e97" },
    "totp_secret_included": { "const": true },
    "version": { "const": 1 }
  }
}
