{"bundle_a_ciphertext_sha256":"62453e052463b8ac4c177f9a40f928dac76cad7b7335b1934c10c8dce75d71a1","bundle_a_result_sha256":"de7897cc59724ac8c79bb7c3a3c24366d20c0cd866a0291c6d33560359f1c53c","bundle_a_state":"protected-local","bundle_b_bytes":114746920,"bundle_b_ciphertext_sha256":"4b62aaa4857ec68822392752d3cce758af981e106b79d8cb969cd6538bb14164","bundle_b_disposition":"created-version","bundle_b_encryption":"aws:kms","bundle_b_object_key_sha256":"597d15ebe79ac54dbdd3a787867bf44c38379901e3dbd33a6e16d36898307324","bundle_b_prior_version_id_sha256":"1745304c103e11d6f405b87bcc3be27ac34e37b96898d5250d1f1c14908c8185","bundle_b_publication_evidence_sha256":"e3b2dc6370c920cf151d5df5c45f6bac64e4492fedbb1f1db30b28e52cca1b86","bundle_b_result_sha256":"21a93c627f8b654f749a5beb97e78c526fcf4cc98d61f1eb1de60ee002f96420","bundle_b_state":"published-verified-current","bundle_b_version_id_sha256":"a4612764198e566db4990bb054a0a9184e8b5e4d86fa1e9f037a017b90b95565","independent_ciphertexts":true,"plaintext_sha256":"24fb612e32aa3f269b46cd718af12086ad758e3bbd95cae0dfc612205a202cf2","published_at":"2026-09-03T00:19:18Z","recovery_evidence_sha256":"ad308dc8d9fd05fd014a0c97189c78b77446c0972a3814cb036cc78f0d4d8b5c","repository_id":"dce8dbc3cde106047631317a09257c23ee5eab4d9ece5f88d52108ae384a8503","snapshot_id":"a42e4694ac164d62bb1c815144ea6407f70ab1e8ee91c54f293b2acdb77dcfea","source_commit":"72909b5723ae8d586f5b3db428b7d73f6c610e97","totp_secret_included":true,"version":1}
